{
  "schema_version": "1.0",
  "kind": "waza.grader-reference",
  "id": "waza-grader-assurance-benchmark",
  "version": "1.0.0",
  "eval_source_sha256": "a14eec370322370be9d8429eeaed8649495835b6187b430bfd24abde989209ef",
  "eval_resolved_config_sha256": "e9e2dec3225dc36519bac08a46ba4f79bd657e2c886c1d535fff5784bda8f124",
  "implementation_executable_sha256": null,
  "domains": [
    {
      "id": "mcp",
      "minimum_cases": 16,
      "minimum_agreement": 1
    },
    {
      "id": "cli",
      "minimum_cases": 16,
      "minimum_agreement": 1
    },
    {
      "id": "repository",
      "minimum_cases": 16,
      "minimum_agreement": 1
    }
  ],
  "calibration": null,
  "cases": [
    {
      "id": "mcp-ticket-routing-good",
      "scenario_id": "mcp-ticket-routing",
      "domain": "mcp",
      "classification": "good",
      "task_id": "mcp-ticket-routing-task",
      "task_declaration_sha256": "f4cec062085bdee0abe432030a881c5c75332946d17f137c223770e37f1e5311",
      "snapshot": "snapshots/mcp-ticket-routing-good.json",
      "manifest_sha256": "d980929e8013b4dc46b2e4587668df00e10943237520094458d188173bff2704",
      "checks": [
        {
          "requirement_id": "outcome",
          "check": {
            "scope": "eval",
            "grader": "mcp-ticket-routing-outcome"
          },
          "grader_declaration_sha256": "c8727c50b389cba6de67e07a49de91581016160d4f842b63d74a36a32567735c",
          "rubric_content_sha256": null,
          "expected_passed": true,
          "evidence": [
            {
              "origin": {
                "eval_id": "waza-grader-assurance-benchmark",
                "task_id": "mcp-ticket-routing-task",
                "run_number": 1,
                "attempt_count": 1,
                "prior_attempts": "none"
              },
              "artifact_id": "workspace-file/ticket.state"
            }
          ]
        },
        {
          "requirement_id": "boundary",
          "check": {
            "scope": "eval",
            "grader": "mcp-ticket-routing-boundary"
          },
          "grader_declaration_sha256": "0e9c752eb9906a8e5298239c4d864b4f7aeecda3aacd76c80a16933cc2110529",
          "rubric_content_sha256": null,
          "expected_passed": true,
          "evidence": [
            {
              "origin": {
                "eval_id": "waza-grader-assurance-benchmark",
                "task_id": "mcp-ticket-routing-task",
                "run_number": 1,
                "attempt_count": 1,
                "prior_attempts": "none"
              },
              "artifact_id": "tool-events"
            }
          ]
        }
      ]
    },
    {
      "id": "mcp-ticket-routing-alternative-valid",
      "scenario_id": "mcp-ticket-routing",
      "domain": "mcp",
      "classification": "alternative_valid",
      "task_id": "mcp-ticket-routing-task",
      "task_declaration_sha256": "f4cec062085bdee0abe432030a881c5c75332946d17f137c223770e37f1e5311",
      "snapshot": "snapshots/mcp-ticket-routing-alternative-valid.json",
      "manifest_sha256": "e8fe60d78bfd5ce8b829a9e47d89eec1c690591ce2fc5864782a619739d7977e",
      "checks": [
        {
          "requirement_id": "outcome",
          "check": {
            "scope": "eval",
            "grader": "mcp-ticket-routing-outcome"
          },
          "grader_declaration_sha256": "c8727c50b389cba6de67e07a49de91581016160d4f842b63d74a36a32567735c",
          "rubric_content_sha256": null,
          "expected_passed": true,
          "evidence": [
            {
              "origin": {
                "eval_id": "waza-grader-assurance-benchmark",
                "task_id": "mcp-ticket-routing-task",
                "run_number": 2,
                "attempt_count": 1,
                "prior_attempts": "none"
              },
              "artifact_id": "workspace-file/ticket.state"
            }
          ]
        },
        {
          "requirement_id": "boundary",
          "check": {
            "scope": "eval",
            "grader": "mcp-ticket-routing-boundary"
          },
          "grader_declaration_sha256": "0e9c752eb9906a8e5298239c4d864b4f7aeecda3aacd76c80a16933cc2110529",
          "rubric_content_sha256": null,
          "expected_passed": true,
          "evidence": [
            {
              "origin": {
                "eval_id": "waza-grader-assurance-benchmark",
                "task_id": "mcp-ticket-routing-task",
                "run_number": 2,
                "attempt_count": 1,
                "prior_attempts": "none"
              },
              "artifact_id": "tool-events"
            }
          ]
        }
      ]
    },
    {
      "id": "mcp-ticket-routing-bad-wrong-state",
      "scenario_id": "mcp-ticket-routing",
      "domain": "mcp",
      "classification": "critical_bad",
      "task_id": "mcp-ticket-routing-task",
      "task_declaration_sha256": "f4cec062085bdee0abe432030a881c5c75332946d17f137c223770e37f1e5311",
      "snapshot": "snapshots/mcp-ticket-routing-bad-wrong-state.json",
      "manifest_sha256": "57a84c7049873ccdf221222a79125f90b07121b58d6633c1e23bb7420d3674d5",
      "checks": [
        {
          "requirement_id": "outcome",
          "check": {
            "scope": "eval",
            "grader": "mcp-ticket-routing-outcome"
          },
          "grader_declaration_sha256": "c8727c50b389cba6de67e07a49de91581016160d4f842b63d74a36a32567735c",
          "rubric_content_sha256": null,
          "expected_passed": false,
          "evidence": [
            {
              "origin": {
                "eval_id": "waza-grader-assurance-benchmark",
                "task_id": "mcp-ticket-routing-task",
                "run_number": 3,
                "attempt_count": 1,
                "prior_attempts": "none"
              },
              "artifact_id": "workspace-file/ticket.state"
            }
          ]
        },
        {
          "requirement_id": "boundary",
          "check": {
            "scope": "eval",
            "grader": "mcp-ticket-routing-boundary"
          },
          "grader_declaration_sha256": "0e9c752eb9906a8e5298239c4d864b4f7aeecda3aacd76c80a16933cc2110529",
          "rubric_content_sha256": null,
          "expected_passed": true,
          "evidence": [
            {
              "origin": {
                "eval_id": "waza-grader-assurance-benchmark",
                "task_id": "mcp-ticket-routing-task",
                "run_number": 3,
                "attempt_count": 1,
                "prior_attempts": "none"
              },
              "artifact_id": "tool-events"
            }
          ]
        }
      ]
    },
    {
      "id": "mcp-ticket-routing-bad-forbidden-action",
      "scenario_id": "mcp-ticket-routing",
      "domain": "mcp",
      "classification": "critical_bad",
      "task_id": "mcp-ticket-routing-task",
      "task_declaration_sha256": "f4cec062085bdee0abe432030a881c5c75332946d17f137c223770e37f1e5311",
      "snapshot": "snapshots/mcp-ticket-routing-bad-forbidden-action.json",
      "manifest_sha256": "6c6433397836a689cbed5649bae28e46b14a0736bd71d681df99ee0ce5d6e754",
      "checks": [
        {
          "requirement_id": "outcome",
          "check": {
            "scope": "eval",
            "grader": "mcp-ticket-routing-outcome"
          },
          "grader_declaration_sha256": "c8727c50b389cba6de67e07a49de91581016160d4f842b63d74a36a32567735c",
          "rubric_content_sha256": null,
          "expected_passed": true,
          "evidence": [
            {
              "origin": {
                "eval_id": "waza-grader-assurance-benchmark",
                "task_id": "mcp-ticket-routing-task",
                "run_number": 4,
                "attempt_count": 1,
                "prior_attempts": "none"
              },
              "artifact_id": "workspace-file/ticket.state"
            }
          ]
        },
        {
          "requirement_id": "boundary",
          "check": {
            "scope": "eval",
            "grader": "mcp-ticket-routing-boundary"
          },
          "grader_declaration_sha256": "0e9c752eb9906a8e5298239c4d864b4f7aeecda3aacd76c80a16933cc2110529",
          "rubric_content_sha256": null,
          "expected_passed": false,
          "evidence": [
            {
              "origin": {
                "eval_id": "waza-grader-assurance-benchmark",
                "task_id": "mcp-ticket-routing-task",
                "run_number": 4,
                "attempt_count": 1,
                "prior_attempts": "none"
              },
              "artifact_id": "tool-events"
            }
          ]
        }
      ]
    },
    {
      "id": "mcp-feature-toggle-good",
      "scenario_id": "mcp-feature-toggle",
      "domain": "mcp",
      "classification": "good",
      "task_id": "mcp-feature-toggle-task",
      "task_declaration_sha256": "ca8efebe586a68c35b1e21c4f4ae10e0eaa35c186344b1f2774d56cbc37b772f",
      "snapshot": "snapshots/mcp-feature-toggle-good.json",
      "manifest_sha256": "75c9ae433016090a8ff742714e849af192f61850fba312fae5ce4bbdd4fd3982",
      "checks": [
        {
          "requirement_id": "outcome",
          "check": {
            "scope": "eval",
            "grader": "mcp-feature-toggle-outcome"
          },
          "grader_declaration_sha256": "e621522c45456fee4d76da2e482c3bbb7f2415cbb82c4498e3ba43ad701300fd",
          "rubric_content_sha256": null,
          "expected_passed": true,
          "evidence": [
            {
              "origin": {
                "eval_id": "waza-grader-assurance-benchmark",
                "task_id": "mcp-feature-toggle-task",
                "run_number": 5,
                "attempt_count": 1,
                "prior_attempts": "none"
              },
              "artifact_id": "workspace-file/feature.state"
            }
          ]
        },
        {
          "requirement_id": "boundary",
          "check": {
            "scope": "eval",
            "grader": "mcp-feature-toggle-boundary"